{
  "format": "zryna.generic-review.v1",
  "status": "candidate-only",
  "sourceCases": [
    {
      "id": "function-one",
      "source": "function identity<T extends ZrynaValue>(value: T): T { return value; }",
      "parserErrors": 0,
      "decision": "admit",
      "code": null,
      "primaryToken": null,
      "primaryOccurrence": null
    },
    {
      "id": "function-two",
      "source": "function select<T extends ZrynaValue, E extends ZrynaValue>(value: T, error: E): T { return value; }",
      "parserErrors": 0,
      "decision": "admit",
      "code": null,
      "primaryToken": null,
      "primaryOccurrence": null
    },
    {
      "id": "nominal-struct",
      "source": "export interface Box<T extends ZrynaValue> extends ZrynaStruct { value: T; }",
      "parserErrors": 0,
      "decision": "admit",
      "code": null,
      "primaryToken": null,
      "primaryOccurrence": null
    },
    {
      "id": "nominal-enum",
      "source": "interface Choice<T extends ZrynaValue, E extends ZrynaValue> extends ZrynaEnum { ok: T; err: E; none: ZrynaNone; }",
      "parserErrors": 0,
      "decision": "admit",
      "code": null,
      "primaryToken": null,
      "primaryOccurrence": null
    },
    {
      "id": "explicit-call",
      "source": "function identity<T extends ZrynaValue>(value: T): T { return value; } function score(): i32 { return identity<i32>(7); }",
      "parserErrors": 0,
      "decision": "admit",
      "code": null,
      "primaryToken": null,
      "primaryOccurrence": null
    },
    {
      "id": "struct-construction",
      "source": "interface Box<T extends ZrynaValue> extends ZrynaStruct { value: T; } function score(): i32 { const box: Box<i32> = Box<i32>({ value: 7 }); return box.value; }",
      "parserErrors": 0,
      "decision": "admit",
      "code": null,
      "primaryToken": null,
      "primaryOccurrence": null
    },
    {
      "id": "user-enum-construction",
      "source": "const value: Choice<i32, String> = Choice.ok<i32, String>(7);",
      "parserErrors": 0,
      "decision": "admit",
      "code": null,
      "primaryToken": null,
      "primaryOccurrence": null
    },
    {
      "id": "option-none",
      "source": "const value: Option<i32> = Option.none<i32>();",
      "parserErrors": 0,
      "decision": "admit",
      "code": null,
      "primaryToken": null,
      "primaryOccurrence": null
    },
    {
      "id": "option-some",
      "source": "const value: Option<i32> = Option.some<i32>(7);",
      "parserErrors": 0,
      "decision": "admit",
      "code": null,
      "primaryToken": null,
      "primaryOccurrence": null
    },
    {
      "id": "result-ok",
      "source": "const value: Result<i32, String> = Result.ok<i32, String>(7);",
      "parserErrors": 0,
      "decision": "admit",
      "code": null,
      "primaryToken": null,
      "primaryOccurrence": null
    },
    {
      "id": "result-err",
      "source": "const value: Result<i32, String> = Result.err<i32, String>(message);",
      "parserErrors": 0,
      "decision": "admit",
      "code": null,
      "primaryToken": null,
      "primaryOccurrence": null
    },
    {
      "id": "nested-container",
      "source": "const value: Vec<Option<i32>> = Vec<Option<i32>>([Option.some<i32>(7)]);",
      "parserErrors": 0,
      "decision": "admit",
      "code": null,
      "primaryToken": null,
      "primaryOccurrence": null
    },
    {
      "id": "complete-match",
      "source": "const score: i32 = match(value, { \"Option.none\": () => 0, \"Option.some\": (item) => item });",
      "parserErrors": 0,
      "decision": "admit",
      "code": null,
      "primaryToken": null,
      "primaryOccurrence": null
    },
    {
      "id": "shared-match",
      "source": "const loan: Borrow<Option<String>> = borrow(owner); const score: i32 = match(loan, { \"Option.none\": () => 0, \"Option.some\": (item) => 1 });",
      "parserErrors": 0,
      "decision": "admit",
      "code": null,
      "primaryToken": null,
      "primaryOccurrence": null
    },
    {
      "id": "exclusive-match",
      "source": "const loan: BorrowMut<Option<i32>> = borrowMut(owner); const score: i32 = match(loan, { \"Option.none\": () => 0, \"Option.some\": (item) => item });",
      "parserErrors": 0,
      "decision": "admit",
      "code": null,
      "primaryToken": null,
      "primaryOccurrence": null
    },
    {
      "id": "borrowed-signature",
      "source": "function read<T extends ZrynaValue>(value: Borrow<T>): i32 { return 1; }",
      "parserErrors": 0,
      "decision": "admit",
      "code": null,
      "primaryToken": null,
      "primaryOccurrence": null
    },
    {
      "id": "finite-supplied-nesting",
      "source": "interface Box<T extends ZrynaValue> extends ZrynaStruct { value: T; } const value: Box<Box<i32>> = Box<Box<i32>>({ value: Box<i32>({ value: 7 }) });",
      "parserErrors": 0,
      "decision": "admit",
      "code": null,
      "primaryToken": null,
      "primaryOccurrence": null
    },
    {
      "id": "same-key-indirection",
      "source": "interface Node<T extends ZrynaValue> extends ZrynaStruct { next: Vec<Node<T>>; }",
      "parserErrors": 0,
      "decision": "admit",
      "code": null,
      "primaryToken": null,
      "primaryOccurrence": null
    },
    {
      "id": "missing-bound",
      "source": "function f<T>(value: T): T { return value; }",
      "parserErrors": 0,
      "decision": "reject",
      "code": "ZRYNA-D7001",
      "primaryToken": "T",
      "primaryOccurrence": 0
    },
    {
      "id": "wrong-bound",
      "source": "function f<T extends Copy>(value: T): T { return value; }",
      "parserErrors": 0,
      "decision": "reject",
      "code": "ZRYNA-D7001",
      "primaryToken": "Copy",
      "primaryOccurrence": 0
    },
    {
      "id": "three-parameters",
      "source": "function f<T extends ZrynaValue, E extends ZrynaValue, U extends ZrynaValue>(value: T): T { return value; }",
      "parserErrors": 0,
      "decision": "reject",
      "code": "ZRYNA-D7001",
      "primaryToken": "U",
      "primaryOccurrence": 0
    },
    {
      "id": "default-parameter",
      "source": "function f<T extends ZrynaValue = i32>(value: T): T { return value; }",
      "parserErrors": 0,
      "decision": "reject",
      "code": "ZRYNA-D7001",
      "primaryToken": "=",
      "primaryOccurrence": 0
    },
    {
      "id": "structural-type",
      "source": "type Box<T extends ZrynaValue> = { value: T };",
      "parserErrors": 0,
      "decision": "reject",
      "code": "ZRYNA-D7001",
      "primaryToken": "type",
      "primaryOccurrence": 0
    },
    {
      "id": "local-template",
      "source": "function score(): i32 { function identity<T extends ZrynaValue>(value: T): T { return value; } return 0; }",
      "parserErrors": 0,
      "decision": "reject",
      "code": "ZRYNA-D7001",
      "primaryToken": "identity",
      "primaryOccurrence": 0
    },
    {
      "id": "omitted-argument",
      "source": "identity(7);",
      "parserErrors": 0,
      "decision": "reject",
      "code": "ZRYNA-M7001",
      "primaryToken": "identity",
      "primaryOccurrence": 0
    },
    {
      "id": "extra-argument",
      "source": "identity<i32, bool>(7);",
      "parserErrors": 0,
      "decision": "reject",
      "code": "ZRYNA-M7001",
      "primaryToken": "bool",
      "primaryOccurrence": 0
    },
    {
      "id": "three-arguments",
      "source": "select<i32, bool, String>(7, true);",
      "parserErrors": 0,
      "decision": "reject",
      "code": "ZRYNA-M7001",
      "primaryToken": "String",
      "primaryOccurrence": 0
    },
    {
      "id": "borrow-argument",
      "source": "identity<Borrow<i32>>(loan);",
      "parserErrors": 0,
      "decision": "reject",
      "code": "ZRYNA-M7001",
      "primaryToken": "Borrow",
      "primaryOccurrence": 0
    },
    {
      "id": "unit-argument",
      "source": "Option.none<unit>();",
      "parserErrors": 0,
      "decision": "reject",
      "code": "ZRYNA-M7001",
      "primaryToken": "unit",
      "primaryOccurrence": 0
    },
    {
      "id": "opaque-clone",
      "source": "function f<T extends ZrynaValue>(value: T): T { return clone(value); }",
      "parserErrors": 0,
      "decision": "reject",
      "code": "ZRYNA-M7002",
      "primaryToken": "clone",
      "primaryOccurrence": 0
    },
    {
      "id": "opaque-arithmetic",
      "source": "function f<T extends ZrynaValue>(value: T): T { return value + value; }",
      "parserErrors": 0,
      "decision": "reject",
      "code": "ZRYNA-M7002",
      "primaryToken": "+",
      "primaryOccurrence": 0
    },
    {
      "id": "recursive-function",
      "source": "function f<T extends ZrynaValue>(value: T): T { return f<T>(value); }",
      "parserErrors": 0,
      "decision": "reject",
      "code": "ZRYNA-M7003",
      "primaryToken": "f<T>",
      "primaryOccurrence": 0
    },
    {
      "id": "expanding-declaration",
      "source": "interface Nest<T extends ZrynaValue> extends ZrynaStruct { next: Vec<Nest<Vec<T>>>; }",
      "parserErrors": 0,
      "decision": "reject",
      "code": "ZRYNA-M7003",
      "primaryToken": "Nest<Vec<T>>",
      "primaryOccurrence": 0
    },
    {
      "id": "by-value-cycle",
      "source": "interface Node<T extends ZrynaValue> extends ZrynaStruct { next: Node<T>; }",
      "parserErrors": 0,
      "decision": "reject",
      "code": "ZRYNA-L3002",
      "primaryToken": "Node<T>",
      "primaryOccurrence": 0
    },
    {
      "id": "unknown-variant",
      "source": "Option.empty<i32>();",
      "parserErrors": 0,
      "decision": "reject",
      "code": "ZRYNA-M7004",
      "primaryToken": "empty",
      "primaryOccurrence": 0
    },
    {
      "id": "missing-arm",
      "source": "match(value, { \"Result.ok\": (item) => item });",
      "parserErrors": 0,
      "decision": "reject",
      "code": "ZRYNA-M7004",
      "primaryToken": "match",
      "primaryOccurrence": 0
    },
    {